{
  "version": 4,
  "name": "jaggedalliance2.zip",
  "items": [
    "Jagged Alliance 2.sh",
    "jaggedalliance2"
  ],
  "items_opt": [],
  "attr": {
    "title": "Jagged Alliance 2",
    "porter": [
      "RoyalJupiter"
    ],
    "desc": "Jagged Alliance 2 is strategy game where you lead a group of mercenaries on the island state of Arulco, against the army of the evil Queen Deirdranna.",
    "desc_md": null,
    "inst": "You must have an updated copy of the original Jagged Alliance 2 game files. Copy the retail game's data into the `ports/jaggedalliance2/game` folder. The GOG version of the game is also supported. Download the installer from GOG (https://www.gog.com/en/game/jagged_alliance_2), place it into the `ports/jaggedalliance2` folder, and it will install the game files as required. ",
    "inst_md": null,
    "genres": [
      "strategy"
    ],
    "image": null,
    "rtr": false,
    "exp": false,
    "runtime": [],
    "store": [
      {
        "name": "GOG",
        "gameurl": "\"https://www.gog.com/en/game/jagged_alliance_2",
        "developerurl": ""
      },
      {
        "name": "Jagged Alliance 2 Stracciatella",
        "gameurl": "https://ja2-stracciatella.github.io/",
        "developerurl": ""
      }
    ],
    "availability": "paid",
    "reqs": [
      "power"
    ],
    "arch": [
      "aarch64"
    ],
    "min_glibc": ""
  }
}
