{
    "version": 2,
    "name": "jazz2.zip",
    "items": [
        "Jazz2 Resurrection.sh",
        "jazz2"
    ],
    "items_opt": null,
    "attr": {
        "title": "Jazz2 Resurrection",
        "porter": [
            "Orson"
        ],
        "desc": "Jazz2 Resurrection is a complete reimplementation of Jazz Jackrabbit 2, a superb 2D platformer, a sequel to Epic Megagames' earlier shareware classic Jazz Jackrabbit (also available in PortMaster).",
        "inst": "Let the intro play the first time you start the game, so it creates cache files. Copy the original game files (The Secret Files and/or The Christmas Chronicles) to ports/jazz2/Source.",
        "genres": [
            "platformer"
        ],
        "image": null,
        "rtr": false,
        "runtime": null,
        "reqs": [],
        "arch": [
            "aarch64",
            "x86_64"
        ]
    },
    "status": {
        "source": "Unknown",
        "md5": null,
        "status": "Installed"
    },
    "files": {
        "port.json": "jazz2/jazz2.port.json",
        "Jazz2 Resurrection.sh": "Jazz2 Resurrection.sh",
        "jazz2": "jazz2"
    }
}
