{
    "version": 2,
    "name": "jediacademy.zip",
    "items": [
        "JediAcademy/",
        "Star Wars Jedi Knight - Jedi Academy.sh"
    ],
    "items_opt": null,
    "attr": {
        "title": "Star Wars Jedi Knight - Jedi Academy",
        "desc": "An open source port of Jedi Academy using OpenJK by the JACoders team. Originally developed by Raven Software.",
        "inst": "You need to add your own full game pak files to the ports/JediAcademy/base folder.",
        "genres": [
            "fps"
        ],
        "porter": [
            "brooksytech"
        ],
        "image": {},
        "rtr": false,
        "runtime": null,
        "reqs": [
            "power"
        ],
        "arch": [
            "aarch64"
        ]
    }
}